{
  "schema_version": "1.0",
  "step_id": "wave-2:handoff",
  "objective": "Closed in wave 2: runtime-replay, governed-runtime-inheritance. Open: validate-on-read and multi-hop-matched-cost (now unblocked). validate-on-read stays open: memory.validate_event checks schema, re-runs the verifier and matches verifier_result, but nothing binds a record's content, so a well-formed edit (e.g. output.objective changed to another non-empty string, or node_id/objective/recorded_at changed) still reads back as trusted. It needs content integrity checked on read (e.g. a digest or hash chain kept outside the event, since memory_event.schema.json is frozen with additionalProperties false) for JSONL and SQLite, without breaking replay byte-identity. multi-hop-matched-cost should build on governed_runtime.run_runtime_poisoning and Orchestrator.run_governed_chain: inject contamination several generations deep and compare with evidence-gated shared memory at equal check cost.",
  "success_criteria": [
    "The blackboard posts only open items whose depends_on items are all closed",
    "At least one task is accepted by the integrator",
    "Each closed item fully meets its acceptance text, not only the task's success criteria",
    "A well-formed but content-edited stored record is rejected on read before validate-on-read is closed"
  ],
  "required_memory_refs": [
    "ledger:latest",
    "backlog:item:validate-on-read",
    "backlog:item:multi-hop-matched-cost",
    "code:src/neural_node_swarm/memory.py",
    "code:src/neural_node_swarm/sqlite_storage.py",
    "code:src/neural_node_swarm/replay.py",
    "code:src/neural_node_swarm/governed_runtime.py",
    "code:src/neural_node_swarm/orchestrator.py",
    "code:src/neural_node_swarm/inheritance_store.py",
    "code:src/neural_node_swarm/poisoning_experiment.py"
  ],
  "constraints": [
    "No live model calls and no network access in code or tests",
    "Do not edit any existing schema file; keep src/neural_node_swarm/schemas/ byte-identical to schemas/",
    "MemoryStore.events() now raises VerificationError on any invalid record, so every stored output must be a fully valid node output",
    "Keep replay_run byte-identical for untouched logs; an integrity mechanism must stay deterministic under injected id_source and clock",
    "validate-on-read and multi-hop-matched-cost may run in parallel only if one stays out of memory.py"
  ]
}
