{
  "schema_version": "1.0",
  "step_id": "node-3:3",
  "objective": "Start packaged-schemas: verify_node_output (verifier.py) and the memory-event validator (memory.py) load schemas from the repository's schemas/ directory via parents[2], which a built non-editable install does not have. Ship byte-identical copies of the schemas inside the neural_node_swarm package (for example src/neural_node_swarm/schemas/, loaded with importlib.resources) and add tests that every packaged copy is byte-identical to schemas/ and that verification works when only the packaged copies are available. Do not change pytest configuration in pyproject.toml.",
  "success_criteria": [
    "At least one new test fails on the parent commit and passes on the work commit",
    "The full test suite is green",
    "No frozen path changes"
  ],
  "required_memory_refs": [
    "ledger:latest",
    "backlog:item:packaged-schemas",
    "code:src/neural_node_swarm/verifier.py",
    "code:src/neural_node_swarm/memory.py",
    "code:pyproject.toml"
  ],
  "constraints": [
    "No live model calls and no network access in code or tests",
    "One backlog item per run"
  ]
}
